{"module_id":"M17","schema_version":"1.0","scenario_id":"f06-provider-loss-repaired","pair_id":"F06","variant":"repaired","seed":1706,"model":{"model_version":"atlas-model-v1","tokenizer_version":"atlas-tokenizer-v1","prompt_policy_version":"atlas-prompt-v1","precision":"fp16-modeled","layers":12,"kv_heads":4,"head_dim":16,"bytes_per_value":2,"weights_bytes":600000000,"runtime_bytes":80000000,"activation_bytes":20000000},"hardware":{"evidence_kind":"modeled","device":"portable-capacity-model","memory_capacity_bytes":1000000000},"workload":{"interactive_requests":12,"batch_requests":8,"short_prompt_tokens":96,"long_prompt_tokens":2048,"max_output_tokens":160,"queue_limit":16,"deadline_ms":2000,"provider_available":false},"controls":{"enforce_memory_budget":true,"length_aware_scheduling":true,"bounded_admission":true,"versioned_cache_identity":true,"quality_gated_precision":true,"bounded_provider_failover":true},"expected":{"target_invariant":"I08","repaired_invariants":["I01","I02","I03","I04","I05","I06","I07","I08","I09","I10"]}}
